{
  "schemaVersion": "1.0.0",
  "batchId": "BR-001-checkout-refunds",
  "fromFingerprint": "3f9a1c0d5e7b24a86c1d0e9f7a3b5c2d4e6f8091a2b3c4d5e6f708192a3b4c5d",
  "toFingerprint": "8e2b7d4c1a09f36e5d2c8b7a6f4e3d2c1b0a9f8e7d6c5b4a3928170f6e5d4c3b",
  "revisionSheets": [
    "0f1e2d3c4b5a69788796a5b4c3d2e1f00f1e2d3c4b5a69788796a5b4c3d2e1f0"
  ],
  "respondedAt": "2026-09-17T09:02:11Z",
  "agent": "example-coding-agent 1.0 (self-reported)",
  "responses": [
    {
      "revisionId": "REV-01J8Z3K6Q2M4N5P7R9S0T1V2W3",
      "route": "spec-requirement",
      "outcome": "incorporated",
      "rationale": "新增金額門檻屬新需求，修改 Spec R-002，並重新推導 RF-002 的 Rules 與 AC-003。",
      "locators": [
        {
          "path": "specs/features/refunds/spec.md",
          "anchor": "R-002",
          "blockSha256": "0f1e2d3c4b5a69788796a5b4c3d2e1f00f1e2d3c4b5a69788796a5b4c3d2e1f0"
        },
        {
          "path": "specs/stories/RF-002-refund-approval/acceptance.md",
          "anchor": "AC-003",
          "blockSha256": "a1b2c3d4e5f60718293a4b5c6d7e8f90a1b2c3d4e5f60718293a4b5c6d7e8f90"
        }
      ]
    }
  ]
}
